{
  "case_id": "pulse_5a_001",
  "credibility_level": "CL0",
  "evidence_of": "HW-FR-004 pulse 5a qualification is PENDING. This case manifest records the reduced ISO 16750-2:2012 Test A (legacy pulse 5a, unsuppressed load dump) fixture added by H-06 (issue #49): unclamped Us=79 V (Table 5 lower bound with the footnote a lower-Ri pairing), td=350 ms, tr=5 ms, Ri=0.5 ohm unused metadata, bound from the schema-validated hw/bom/datasheets/extract-iso16750-2-2012.json through hw/tests/cases/pulse_7637_001.simcase.json (pulse_selector 8). The executed checks are numerical invariant regressions against the OR-002 pulse5a tabulation; they establish no standard-qualified oracle, do not qualify the Figure 8 waveform and authorize no HW-FR-004 closure or passing plot.",
  "inherited_validation_gap": "openmodelica: Compiler semantics outside independently validated output remain unqualified; OR-001/OR-002 regressions do not cover all translation and solver behavior.",
  "not_covered": [
    "Figure 8 waveform shape and the 0.9(Us-UA)+UA / 0.1(Us-UA)+UA edge/duration measurement definitions; the fixture uses linear edges and td/3 decay (shape_qualification_pending in the extract; pending #41).",
    "Unclamped-generator topology with exercised source impedance Ri; Ri_pulse5a=0.5 ohm is unused metadata.",
    "Ten-pulse repetition at 1 min intervals, loaded DUT immunity and protection response.",
    "Table 5 upper operating point (Us=101 V with Ri=4 ohm) and the full Us/Ri/td ranges.",
    "T4 physical correlation: bench-pending per HwRS section 5 (oracle absence), issue #41."
  ],
  "oracle_id": "OR-002",
  "pass": false,
  "pending_reason": "ISO 16750-2:2012 Test A (legacy pulse 5a) waveform qualification is deferred to https://github.com/mfreazer/CANcestry-/issues/41: the H-06 fixture binds only the unclamped Us, td and tr values (plus unused Ri metadata) from the datasheet extract, while the Figure 8 waveform shape, its 0.9(Us-UA)+UA / 0.1(Us-UA)+UA edge and duration measurement definitions, the unclamped-generator topology, the exercised source impedance and the ten-pulse repetition at 1 min intervals remain unqualified (shape_qualification_pending in the extract). No qualification promotion is claimed; H-06 scope: issue #49.",
  "provisional": true,
  "pulses": {
    "pulse5a": {
      "coverage": "partial",
      "follow_up": "https://github.com/mfreazer/CANcestry-/issues/41",
      "modeled": "Unclamped generator level Us=79 V per ISO 16750-2:2012 \u00a74.6.4.2.2 Figure 8 / Table 5 lower bound (footnote a pairs it with the lower Ri bound), bound from the schema-validated datasheet extract through the shared sim case (pulse_selector 8). Current fixture uses a 5 ms full linear edge to the 79 V absolute peak and td/3 decay with td=350 ms; Ri=0.5 ohm is unused metadata.",
      "not_modeled": [
        "Figure 8 0.9(Us-UA)+UA / 0.1(Us-UA)+UA edge and duration measurement definitions; td/3 decay is not a qualified oracle.",
        "Unclamped-generator topology and exercised source impedance.",
        "Table 5 ranges beyond the lower-bound operating point (Us to 101 V, Ri to 4 ohm, td to 400 ms) and the 10 ms -5/+0 rising-slope tolerance.",
        "Ten-pulse sequence at 60 s intervals; loaded DUT response.",
        "T4 physical correlation (bench-pending)."
      ],
      "oracle_confidence": "CL0 for complete Test A qualification: the OR-002 pulse5a tabulation is an engineering fixture transcribed from the normative extract, not a qualified Figure 8 waveform. Pending #41; never promote based on numeric regression alone.",
      "oracle_credibility": "CL0",
      "provisional": true,
      "status": "pending"
    }
  },
  "requirement_id": "HW-FR-004",
  "schema_version": "0.1.0",
  "sim_case": "hw/tests/cases/pulse_7637_001.simcase.json",
  "source_hashes": {
    "ci/docker/Dockerfile": "sha256:49703d8b330e41c58e5411bdede3310aec55199e3fb77fc973189b9ee7358102",
    "ci/docker/base-image.digest": "sha256:fbe0594ac4ef88a211f86be44892d6d24efaefd22b747fe6aca41f512e38614f",
    "docs/hw/pulse-coverage.md": "sha256:510049ea2969667fee1c79f61cf02b4225e5974f1f9d412d212528d28daeab43",
    "docs/hw/tool-qualification.md": "sha256:51509f080b4b114345a6285c01e9275a86e9d324c0aa27ffe6425fdfaf78ff53",
    "hw/bom/datasheets/extract-iso16750-2-2012.json": "sha256:10484dee40e91d6f75a458fdd34614b8434d3074cce5436e428b4f9fb4da7e6b",
    "hw/model/CancestryLib/Power/PulseISO7637_2.mo": "sha256:dfc42d3391515aaa160c670e42a45d6c775d373f7ade84a33daab93f5f2b624a",
    "hw/model/CancestryLib/Power/package.mo": "sha256:b764dcccf84d3660c855d2d9712ed63bf7ff3e617a7409fd72d4381a0d527c33",
    "hw/model/CancestryLib/package.mo": "sha256:53662fe968facb4cc3ca5d6ccb0ec8a7b7382224c0122ab5af19b748694e2372",
    "hw/tests/cases/pulse_7637_001.simcase.json": "sha256:74b570797c1d8892551abeefd727281427127a36c8299851d24f74c319ee34e6",
    "hw/tests/oracles/or_002_pulse7637.py": "sha256:0d34e4cfe4c4386962fe4f36f9094c558a1df8ea2ad4a7941c9690913e09b9d5",
    "hw/tests/oracles/registry.csv": "sha256:7e478f80772bf29e09b02981684e06784646adb7459fe95afd38982d8836a6ba",
    "hw/tests/oracles/registry.json": "sha256:9480431021cb56920a3236968accebf60b98a6ef0ac5835957cd471538b00345",
    "hw/tests/test_evidence_determinism.py": "sha256:500ec90fc931cf7bea8902e6e1ddc2a4be2dbcba12e11cd457766b4b32a4e760",
    "hw/tests/test_power_sim.py": "sha256:26194fe5303bec1242ed2e2717e0fb4050ba64795905df7631d3e82b3b173487",
    "hw/tests/test_pulse_sim.py": "sha256:c798759d945b2888002ae55cf8ff744af06059646feb29d20a6ce76665a5117a",
    "schemas/hw/hw-datasheet-extract-0.1.0.schema.json": "sha256:cd9de8b653e8b774926eaa3953c7122ea64bd1d3ec64de906b48ec0465ac5eff",
    "schemas/hw/hw-oracle-registry-0.1.0.schema.json": "sha256:7bd0a15770f2bae185600bd554198a791ab94dceb59b4d8084111d5bf01e6123",
    "schemas/hw/hw-pulse-evidence-0.1.0.schema.json": "sha256:c3fd6826c02969106f410198a3630dbb40a75975c22cde8939e26bccdc01f64e",
    "schemas/hw/hw-sim-0.1.0.schema.json": "sha256:efa2591e203a56f9fe3792d0bbdd891ce3b3b01bab52e2976b11ad417bd35f6a"
  },
  "status": "pending",
  "tolerances": {
    "decay_tau_relative": 0.1,
    "duration_relative": 0.02,
    "peak_relative": 0.02,
    "time_to_peak_relative": 0.05
  },
  "tool_pins": {
    "fmpy": "0.3.24",
    "numpy": "2.1.3",
    "openmodelica": "1.24",
    "python": ">=3.10"
  },
  "trace": {
    "artifact": "build/hw/pulse_7637_001_pulse5a.trace.csv (per-run artifact, gitignored)",
    "columns": "time_s,v_v",
    "hashing": "sha256 of the pulse5a trace, measured invariants and measured tool pins recorded in build/hw/pulse_7637_001.runlog.json"
  },
  "unexercised_parameters": [
    "Ri_pulse5a"
  ]
}
